{
  "$schema": "https://json-schema.org/draft/2020-12/schema",
  "$id": "https://segment-scanner.invalid/schemas/job-v1.schema.json",
  "type": "object",
  "additionalProperties": false,
  "required": ["schemaVersion","jobId","attemptId","serverId","modes","items","introductionSettings","introductionProfileHash","creditsProfileId","creditsProfileHash","leaseToken","leaseGeneration","leaseExpiresUtc","offlineContextId"],
  "allOf": [{"if":{"properties":{"serverId":{"type":"string"},"modes":{"contains":{"const":"Credits"}}}},"then":{"properties":{"creditsProfileHash":{"pattern":"^[a-f0-9]{64}$"}}}}],
  "properties": {"schemaVersion":{"const":1},"jobId":{"$ref":"#/$defs/guid"},"attemptId":{"$ref":"#/$defs/guid"},"serverId":{"type":["string","null"]},"modes":{"type":"array","minItems":1,"maxItems":5,"uniqueItems":true,"items":{"enum":["Introduction","Credits","Recap","Preview","Commercial"]}},"items":{"type":"array","minItems":1,"maxItems":100,"items":{"$ref":"#/$defs/item"}},"introductionSettings":{"type":"object"},"introductionProfileHash":{"type":"string"},"creditsProfileId":{"type":"string"},"creditsProfileHash":{"type":"string"},"leaseToken":{"type":["string","null"]},"leaseGeneration":{"type":"integer","minimum":0},"leaseExpiresUtc":{"type":["string","null"],"format":"date-time"},"offlineContextId":{"type":["string","null"]},"nodeId":{"type":["string","null"],"minLength":1,"maxLength":200},"nodeRevision":{"type":["string","null"],"pattern":"^[1-9][0-9]*$"},"creditsMethod":{"enum":["TextAware","IntroSkipper"]},"creditsSettings":{"type":["object","null"]},"scanSettings":{"oneOf":[{"type":"null"},{"$ref":"#/$defs/scanSettings"}]},"nodePolicy":{"oneOf":[{"type":"null"},{"$ref":"#/$defs/nodePolicy"}]},"creditsRecipe":{"oneOf":[{"type":"null"},{"$ref":"#/$defs/recipe"}]}},
  "$defs": {"guid":{"type":"string","format":"uuid"},"tick":{"type":"string","pattern":"^[0-9]+$"},"item":{"type":"object","additionalProperties":false,"required":["itemId","mediaSourceKey","sourcePath","pathMapId","fileVersionToken","expectedModeRevisions","seasonKey","order","writeTarget","multipart","runtimeTicks","expectedSignature","chapters"],"properties":{"itemId":{"$ref":"#/$defs/guid"},"mediaSourceKey":{"type":"string","minLength":1},"sourcePath":{"type":"string","minLength":1},"pathMapId":{"type":["string","null"]},"fileVersionToken":{"type":"string","minLength":1},"expectedModeRevisions":{"type":"object","additionalProperties":false,"properties":{"Introduction":{"$ref":"#/$defs/tick"},"Credits":{"$ref":"#/$defs/tick"}}},"seasonKey":{"type":"string"},"order":{"type":"integer"},"writeTarget":{"type":"boolean"},"multipart":{"type":"boolean"},"runtimeTicks":{"$ref":"#/$defs/tick"},"expectedSignature":{"oneOf":[{"type":"null"},{"$ref":"#/$defs/signature"}]},"chaptersAreAuthoritative":{"type":"boolean","default":false},"serverAnalysisConfigHash":{"type":"string","default":""},"chapters":{"type":"array","items":{"$ref":"#/$defs/chapter"}},"isMovie":{"type":"boolean"},"isAnime":{"type":"boolean"},"contextSegments":{"type":["array","null"],"maxItems":100,"items":{"$ref":"#/$defs/contextSegment"}},"contextRevisions":{"type":["object","null"],"propertyNames":{"enum":["Introduction","Credits"]},"additionalProperties":{"type":"string","pattern":"^[a-f0-9]{64}$"}},"seasonNumber":{"type":["integer","null"]},"episodeNumber":{"type":["integer","null"]}}},"signature":{"type":"object","additionalProperties":false,"required":["length","lastWriteUtcTicks","timelineEndTicks","sampleHash","streamLayoutHash"],"properties":{"length":{"$ref":"#/$defs/tick"},"lastWriteUtcTicks":{"$ref":"#/$defs/tick"},"timelineEndTicks":{"$ref":"#/$defs/tick"},"sampleHash":{"type":"string","minLength":1},"streamLayoutHash":{"type":"string","minLength":1}}},"chapter":{"type":"object","additionalProperties":false,"required":["name","startTicks","origin","originId","exportRevision"],"properties":{"name":{"type":"string"},"startTicks":{"$ref":"#/$defs/tick"},"origin":{"enum":["Authored","ScannerGenerated","UserReviewed","Unknown"]},"originId":{"type":["string","null"]},"exportRevision":{"type":["string","null"]}}},"mapping":{"type":"object","additionalProperties":false,"required":["serverPrefix","workerPrefix"],"properties":{"id":{"type":"string"},"serverPrefix":{"type":"string","minLength":1},"workerPrefix":{"type":"string","minLength":1},"caseSensitive":{"type":["boolean","null"]}}},"nodePolicy":{"type":"object","additionalProperties":false,"properties":{"libraryIds":{"type":"array","maxItems":100,"uniqueItems":true,"items":{"$ref":"#/$defs/guid"}},"modes":{"type":"array","maxItems":5,"uniqueItems":true,"items":{"enum":["Introduction","Credits","Recap","Preview","Commercial"]}},"creditsMethod":{"enum":["TextAware","IntroSkipper"]},"useGpu":{"type":"boolean"},"concurrentFiles":{"enum":[1,2,4]},"pathMappings":{"type":"array","maxItems":32,"items":{"$ref":"#/$defs/mapping"}},"automaticImports":{"type":"boolean"},"leaseMinutes":{"type":"integer","minimum":1,"maximum":120}}},"recipe":{"type":"object","additionalProperties":false,"required":["id","profileHash"],"properties":{"id":{"type":"string","minLength":1},"method":{"enum":["TextAware","IntroSkipper"]},"useGpu":{"type":"boolean"},"inferenceBackend":{"enum":["Cpu","OpenClGpu"]},"videoDecoder":{"enum":["Cpu","NvidiaNvdec","IntelQuickSync"]},"profileHash":{"type":"string","pattern":"^[a-f0-9]{64}$"}}},"scanSettings":{"type":"object","additionalProperties":false,"required":["configuration","action"],"properties":{"version":{"const":1},"configuration":{"type":"object"},"action":{"type":"string"}}},"contextSegment":{"type":"object","additionalProperties":false,"required":["mode","startTicks","endTicks"],"properties":{"mode":{"enum":["Introduction","Credits"]},"startTicks":{"$ref":"#/$defs/tick"},"endTicks":{"$ref":"#/$defs/tick"}}}}
}
